{
  "schema": "mimesis.flames.v1",
  "panel": "A",
  "painting_rect_px": [
    4800,
    3600
  ],
  "parameters": {
    "v_percentile": 99.2,
    "value_threshold": 245.0,
    "min_area_frac": 2e-06,
    "max_area_frac": 0.003,
    "warm_hue_range": [
      0,
      45
    ],
    "orphan_threshold_face_heights": 2.5,
    "faces_counted": "consensus",
    "faces_available": 58,
    "faces_used": 12,
    "kind_rule": "ceiling_fixture: centroid above y=0.2 and aspect<1.2; flame: aspect>=1.0 and (warm hue or sat<40) and high local contrast; bright_other: everything else"
  },
  "counts": {
    "blobs": 155,
    "flames": 26,
    "ceiling_fixtures": 25,
    "bright_other": 104,
    "flames_unattached": 1
  },
  "blobs": [
    {
      "blob_id": "AF01",
      "kind": "bright_other",
      "centroid": [
        0.960924,
        0.006537
      ],
      "box": [
        0.960208,
        0.005278,
        0.001875,
        0.003056
      ],
      "area_frac": 3.47e-06,
      "aspect_h_over_w": 1.222,
      "median_hue": 24.0,
      "median_sat": 15.0,
      "mean_value": 251.6,
      "surround_mean_value": 181.5,
      "nearest_face": null
    },
    {
      "blob_id": "AF02",
      "kind": "ceiling_fixture",
      "centroid": [
        0.953181,
        0.009759
      ],
      "box": [
        0.949792,
        0.006389,
        0.008542,
        0.007778
      ],
      "area_frac": 2.448e-05,
      "aspect_h_over_w": 0.683,
      "median_hue": 27.0,
      "median_sat": 21.0,
      "mean_value": 252.3,
      "surround_mean_value": 115.1,
      "nearest_face": null
    },
    {
      "blob_id": "AF03",
      "kind": "ceiling_fixture",
      "centroid": [
        0.962558,
        0.007902
      ],
      "box": [
        0.961667,
        0.006944,
        0.002083,
        0.002222
      ],
      "area_frac": 2.72e-06,
      "aspect_h_over_w": 0.8,
      "median_hue": 22.0,
      "median_sat": 40.0,
      "mean_value": 251.5,
      "surround_mean_value": 199.9,
      "nearest_face": null
    },
    {
      "blob_id": "AF04",
      "kind": "ceiling_fixture",
      "centroid": [
        0.875727,
        0.029044
      ],
      "box": [
        0.874792,
        0.028333,
        0.002083,
        0.001667
      ],
      "area_frac": 2.49e-06,
      "aspect_h_over_w": 0.6,
      "median_hue": 26.0,
      "median_sat": 8.0,
      "mean_value": 252.4,
      "surround_mean_value": 232.3,
      "nearest_face": null
    },
    {
      "blob_id": "AF05",
      "kind": "ceiling_fixture",
      "centroid": [
        0.871602,
        0.031423
      ],
      "box": [
        0.868125,
        0.03,
        0.007083,
        0.003056
      ],
      "area_frac": 1.944e-05,
      "aspect_h_over_w": 0.324,
      "median_hue": 30.0,
      "median_sat": 12.0,
      "mean_value": 253.8,
      "surround_mean_value": 137.6,
      "nearest_face": null
    },
    {
      "blob_id": "AF06",
      "kind": "ceiling_fixture",
      "centroid": [
        0.37992,
        0.031511
      ],
      "box": [
        0.375208,
        0.030556,
        0.009792,
        0.0025
      ],
      "area_frac": 1.591e-05,
      "aspect_h_over_w": 0.191,
      "median_hue": 30.0,
      "median_sat": 9.0,
      "mean_value": 252.9,
      "surround_mean_value": 66.8,
      "nearest_face": null
    },
    {
      "blob_id": "AF07",
      "kind": "ceiling_fixture",
      "centroid": [
        0.87857,
        0.032456
      ],
      "box": [
        0.877292,
        0.031111,
        0.002708,
        0.003333
      ],
      "area_frac": 5.15e-06,
      "aspect_h_over_w": 0.923,
      "median_hue": 26.0,
      "median_sat": 26.0,
      "mean_value": 252.8,
      "surround_mean_value": 191.0,
      "nearest_face": null
    },
    {
      "blob_id": "AF08",
      "kind": "ceiling_fixture",
      "centroid": [
        0.44239,
        0.044414
      ],
      "box": [
        0.435625,
        0.0425,
        0.013333,
        0.004722
      ],
      "area_frac": 3.501e-05,
      "aspect_h_over_w": 0.266,
      "median_hue": 30.0,
      "median_sat": 9.0,
      "mean_value": 252.7,
      "surround_mean_value": 71.1,
      "nearest_face": null
    },
    {
      "blob_id": "AF09",
      "kind": "ceiling_fixture",
      "centroid": [
        0.805445,
        0.046973
      ],
      "box": [
        0.800417,
        0.044722,
        0.010417,
        0.004722
      ],
      "area_frac": 2.558e-05,
      "aspect_h_over_w": 0.34,
      "median_hue": 27.0,
      "median_sat": 52.0,
      "mean_value": 252.5,
      "surround_mean_value": 107.9,
      "nearest_face": null
    },
    {
      "blob_id": "AF10",
      "kind": "ceiling_fixture",
      "centroid": [
        0.808839,
        0.050746
      ],
      "box": [
        0.807917,
        0.049722,
        0.002083,
        0.002222
      ],
      "area_frac": 3.12e-06,
      "aspect_h_over_w": 0.8,
      "median_hue": 18.0,
      "median_sat": 89.5,
      "mean_value": 250.8,
      "surround_mean_value": 196.9,
      "nearest_face": null
    },
    {
      "blob_id": "AF11",
      "kind": "ceiling_fixture",
      "centroid": [
        0.747596,
        0.060312
      ],
      "box": [
        0.744792,
        0.0575,
        0.00625,
        0.006389
      ],
      "area_frac": 1.904e-05,
      "aspect_h_over_w": 0.767,
      "median_hue": 27.0,
      "median_sat": 16.0,
      "mean_value": 252.2,
      "surround_mean_value": 114.4,
      "nearest_face": null
    },
    {
      "blob_id": "AF12",
      "kind": "bright_other",
      "centroid": [
        0.061142,
        0.062987
      ],
      "box": [
        0.060417,
        0.060556,
        0.001458,
        0.005278
      ],
      "area_frac": 5.38e-06,
      "aspect_h_over_w": 2.714,
      "median_hue": 26.0,
      "median_sat": 19.0,
      "mean_value": 252.8,
      "surround_mean_value": 182.9,
      "nearest_face": null
    },
    {
      "blob_id": "AF13",
      "kind": "ceiling_fixture",
      "centroid": [
        0.742326,
        0.062076
      ],
      "box": [
        0.741042,
        0.060833,
        0.002708,
        0.002778
      ],
      "area_frac": 4.63e-06,
      "aspect_h_over_w": 0.769,
      "median_hue": 25.0,
      "median_sat": 34.0,
      "mean_value": 254.1,
      "surround_mean_value": 148.1,
      "nearest_face": null
    },
    {
      "blob_id": "AF14",
      "kind": "ceiling_fixture",
      "centroid": [
        0.750413,
        0.063007
      ],
      "box": [
        0.74875,
        0.061389,
        0.003125,
        0.003333
      ],
      "area_frac": 6.31e-06,
      "aspect_h_over_w": 0.8,
      "median_hue": 24.0,
      "median_sat": 20.0,
      "mean_value": 252.3,
      "surround_mean_value": 177.2,
      "nearest_face": null
    },
    {
      "blob_id": "AF15",
      "kind": "flame",
      "centroid": [
        0.654008,
        0.073073
      ],
      "box": [
        0.651875,
        0.067222,
        0.004583,
        0.014444
      ],
      "area_frac": 2.94e-05,
      "aspect_h_over_w": 2.364,
      "median_hue": 60.0,
      "median_sat": 11.0,
      "mean_value": 249.7,
      "surround_mean_value": 162.1,
      "nearest_face": {
        "face_id": "A49",
        "distance_in_face_heights": 1.52,
        "unattached": false
      }
    },
    {
      "blob_id": "AF16",
      "kind": "ceiling_fixture",
      "centroid": [
        0.695356,
        0.07187
      ],
      "box": [
        0.687292,
        0.068333,
        0.019167,
        0.010833
      ],
      "area_frac": 5.37e-05,
      "aspect_h_over_w": 0.424,
      "median_hue": 73.0,
      "median_sat": 11.0,
      "mean_value": 251.4,
      "surround_mean_value": 123.8,
      "nearest_face": null
    },
    {
      "blob_id": "AF17",
      "kind": "ceiling_fixture",
      "centroid": [
        0.698903,
        0.077269
      ],
      "box": [
        0.696042,
        0.074444,
        0.006042,
        0.006667
      ],
      "area_frac": 1.609e-05,
      "aspect_h_over_w": 0.828,
      "median_hue": 67.0,
      "median_sat": 13.0,
      "mean_value": 247.8,
      "surround_mean_value": 237.1,
      "nearest_face": null
    },
    {
      "blob_id": "AF18",
      "kind": "ceiling_fixture",
      "centroid": [
        0.704733,
        0.078285
      ],
      "box": [
        0.703958,
        0.077222,
        0.001667,
        0.002222
      ],
      "area_frac": 2.66e-06,
      "aspect_h_over_w": 1.0,
      "median_hue": 80.0,
      "median_sat": 15.0,
      "mean_value": 249.8,
      "surround_mean_value": 236.0,
      "nearest_face": null
    },
    {
      "blob_id": "AF19",
      "kind": "flame",
      "centroid": [
        0.696329,
        0.107644
      ],
      "box": [
        0.690208,
        0.078056,
        0.012708,
        0.055556
      ],
      "area_frac": 0.00035723,
      "aspect_h_over_w": 3.279,
      "median_hue": 68.0,
      "median_sat": 11.0,
      "mean_value": 251.2,
      "surround_mean_value": 108.1,
      "nearest_face": {
        "face_id": "A49",
        "distance_in_face_heights": 1.092,
        "unattached": false
      }
    },
    {
      "blob_id": "AF20",
      "kind": "flame",
      "centroid": [
        0.640192,
        0.104988
      ],
      "box": [
        0.632083,
        0.078611,
        0.021875,
        0.055278
      ],
      "area_frac": 0.00052865,
      "aspect_h_over_w": 1.895,
      "median_hue": 52.0,
      "median_sat": 12.0,
      "mean_value": 250.2,
      "surround_mean_value": 126.7,
      "nearest_face": {
        "face_id": "A49",
        "distance_in_face_heights": 1.32,
        "unattached": false
      }
    },
    {
      "blob_id": "AF21",
      "kind": "bright_other",
      "centroid": [
        0.690331,
        0.08317
      ],
      "box": [
        0.688958,
        0.081111,
        0.003333,
        0.005556
      ],
      "area_frac": 9.37e-06,
      "aspect_h_over_w": 1.25,
      "median_hue": 68.0,
      "median_sat": 11.0,
      "mean_value": 248.6,